2025-05-24 07:48:43,876 - INFO - Logging initialized. Log file: logs\simple_sender\run_20250524_074843.log
2025-05-24 07:48:43,876 - INFO - === CLAUDE SIMPLE SENDER STARTING ===
2025-05-24 07:48:43,876 - INFO - Command line args: Namespace(config='config/user_config.yaml', session=None, run_one=False, delay=100, session_delay=10)
2025-05-24 07:48:43,986 - INFO - Loaded configuration from config/user_config.yaml
2025-05-24 07:48:43,986 - INFO - Running all sessions
2025-05-24 07:48:43,986 - INFO - Will run 4 sessions: session5, session6, session7, session8
2025-05-24 07:48:44,001 - INFO - === Starting session: session5 ===
2025-05-24 07:48:44,001 - INFO - Session name: Code Tasks
2025-05-24 07:48:44,017 - INFO - Number of prompts: 6
2025-05-24 07:48:44,033 - INFO - Launching Chrome: C:\Program Files\Google\Chrome\Application\chrome.exe
2025-05-24 07:48:44,048 - INFO - Using profile: C:\Temp\ClaudeProfile
2025-05-24 07:48:44,064 - INFO - Navigating to: https://claude.ai/project/0196f2ac-2f4b-7714-808e-f71ecaaca3f8
2025-05-24 07:48:44,095 - INFO - Waiting for browser to initialize (10 seconds)
2025-05-24 07:48:54,101 - INFO - Running session: session5
2025-05-24 07:48:54,101 - INFO - Waiting 15 seconds for page to load and for user to handle any login...
2025-05-24 07:49:09,106 - INFO - Processing prompt 1/6
2025-05-24 07:49:10,320 - INFO - Typing prompt: Please       Review the opening paragraph of the p...
2025-05-24 07:49:44,520 - INFO - Pressing Enter to send prompt
2025-05-24 07:49:44,624 - INFO - Waiting 100 seconds for response...
2025-05-24 07:50:14,628 - INFO - Still waiting: 69 seconds remaining...
2025-05-24 07:50:44,631 - INFO - Still waiting: 39 seconds remaining...
2025-05-24 07:51:14,632 - INFO - Still waiting: 9 seconds remaining...
2025-05-24 07:51:44,634 - INFO - Completed prompt 1/6
2025-05-24 07:51:44,634 - INFO - Processing prompt 2/6
2025-05-24 07:51:45,851 - INFO - Typing prompt: Please       Evaluate how effectively the opening ...
2025-05-24 07:52:24,693 - INFO - Pressing Enter to send prompt
2025-05-24 07:52:24,809 - INFO - Waiting 100 seconds for response...
2025-05-24 07:52:54,811 - INFO - Still waiting: 69 seconds remaining...
2025-05-24 07:53:24,819 - INFO - Still waiting: 39 seconds remaining...
2025-05-24 07:53:54,821 - INFO - Still waiting: 9 seconds remaining...
2025-05-24 07:54:24,822 - INFO - Completed prompt 2/6
2025-05-24 07:54:24,822 - INFO - Processing prompt 3/6
2025-05-24 07:54:26,039 - INFO - Typing prompt: Please       Examine whether the opening paragraph...
2025-05-24 07:55:08,045 - INFO - Pressing Enter to send prompt
2025-05-24 07:55:08,151 - INFO - Waiting 100 seconds for response...
2025-05-24 07:55:38,153 - INFO - Still waiting: 69 seconds remaining...
2025-05-24 07:56:08,154 - INFO - Still waiting: 39 seconds remaining...
2025-05-24 07:56:38,155 - INFO - Still waiting: 9 seconds remaining...
2025-05-24 07:57:08,157 - INFO - Completed prompt 3/6
2025-05-24 07:57:08,158 - INFO - Processing prompt 4/6
2025-05-24 07:57:09,372 - INFO - Typing prompt: Please       Analyze the very first sentence of th...
2025-05-24 07:57:45,502 - INFO - Pressing Enter to send prompt
2025-05-24 07:57:45,615 - INFO - Waiting 100 seconds for response...
2025-05-24 07:58:15,616 - INFO - Still waiting: 69 seconds remaining...
2025-05-24 07:58:45,618 - INFO - Still waiting: 39 seconds remaining...
2025-05-24 07:59:15,619 - INFO - Still waiting: 9 seconds remaining...
2025-05-24 07:59:45,620 - INFO - Completed prompt 4/6
2025-05-24 07:59:45,620 - INFO - Processing prompt 5/6
2025-05-24 07:59:46,844 - INFO - Typing prompt: Please       Identify any vague, redundant, or unc...
2025-05-24 08:00:14,614 - INFO - Pressing Enter to send prompt
2025-05-24 08:00:14,722 - INFO - Waiting 100 seconds for response...
2025-05-24 08:00:44,724 - INFO - Still waiting: 69 seconds remaining...
2025-05-24 08:01:14,725 - INFO - Still waiting: 39 seconds remaining...
2025-05-24 08:01:44,733 - INFO - Still waiting: 9 seconds remaining...
2025-05-24 08:02:14,735 - INFO - Completed prompt 5/6
2025-05-24 08:02:14,798 - INFO - Processing prompt 6/6
2025-05-24 08:02:16,014 - INFO - Typing prompt: Please       Using all of this information write a...
2025-05-24 08:02:30,233 - INFO - Pressing Enter to send prompt
2025-05-24 08:02:30,345 - INFO - Waiting 100 seconds for response...
2025-05-24 08:03:00,346 - INFO - Still waiting: 69 seconds remaining...
2025-05-24 08:03:30,346 - INFO - Still waiting: 39 seconds remaining...
2025-05-24 08:04:00,347 - INFO - Still waiting: 9 seconds remaining...
2025-05-24 08:04:30,348 - INFO - Completed prompt 6/6
2025-05-24 08:04:30,348 - INFO - All prompts processed.
2025-05-24 08:04:30,348 - INFO - Closing browser...
2025-05-24 08:04:32,477 - INFO - Browser closed.
2025-05-24 08:04:32,477 - INFO - === Session session5 FAILED ===
2025-05-24 08:04:32,477 - INFO - Waiting 10 seconds before next session...
2025-05-24 08:04:42,496 - INFO - === Starting session: session6 ===
2025-05-24 08:04:42,496 - INFO - Session name: Code Tasks
2025-05-24 08:04:42,496 - INFO - Number of prompts: 7
2025-05-24 08:04:42,512 - INFO - Launching Chrome: C:\Program Files\Google\Chrome\Application\chrome.exe
2025-05-24 08:04:42,527 - INFO - Using profile: C:\Temp\ClaudeProfile
2025-05-24 08:04:42,543 - INFO - Navigating to: https://claude.ai/project/0196f2ac-2f4b-7714-808e-f71ecaaca3f8
2025-05-24 08:04:42,543 - INFO - Waiting for browser to initialize (10 seconds)
2025-05-24 08:04:52,556 - INFO - Running session: session6
2025-05-24 08:04:52,556 - INFO - Waiting 15 seconds for page to load and for user to handle any login...
2025-05-24 08:05:07,560 - INFO - Processing prompt 1/7
2025-05-24 08:05:08,782 - INFO - Typing prompt: Please       Review the second paragraph of the co...
2025-05-24 08:05:48,495 - INFO - Pressing Enter to send prompt
2025-05-24 08:05:48,601 - INFO - Waiting 100 seconds for response...
2025-05-24 08:06:18,607 - INFO - Still waiting: 69 seconds remaining...
2025-05-24 08:06:48,608 - INFO - Still waiting: 39 seconds remaining...
2025-05-24 08:07:18,609 - INFO - Still waiting: 9 seconds remaining...
2025-05-24 08:07:48,610 - INFO - Completed prompt 1/7
2025-05-24 08:07:48,610 - INFO - Processing prompt 2/7
2025-05-24 08:07:49,822 - INFO - Typing prompt: Please       Evaluate if the cover letter’s seco...
2025-05-24 08:08:25,950 - INFO - Pressing Enter to send prompt
2025-05-24 08:08:26,056 - INFO - Waiting 100 seconds for response...
2025-05-24 08:08:56,057 - INFO - Still waiting: 69 seconds remaining...
2025-05-24 08:09:26,063 - INFO - Still waiting: 39 seconds remaining...
2025-05-24 08:09:56,064 - INFO - Still waiting: 9 seconds remaining...
2025-05-24 08:10:26,065 - INFO - Completed prompt 2/7
2025-05-24 08:10:26,065 - INFO - Processing prompt 3/7
2025-05-24 08:10:27,282 - INFO - Typing prompt: Please       Analyze the action verbs used in the ...
2025-05-24 08:10:58,475 - INFO - Pressing Enter to send prompt
2025-05-24 08:10:58,589 - INFO - Waiting 100 seconds for response...
2025-05-24 08:11:28,589 - INFO - Still waiting: 69 seconds remaining...
2025-05-24 08:11:58,590 - INFO - Still waiting: 39 seconds remaining...
2025-05-24 08:12:28,592 - INFO - Still waiting: 9 seconds remaining...
2025-05-24 08:12:58,598 - INFO - Completed prompt 3/7
2025-05-24 08:12:58,598 - INFO - Processing prompt 4/7
2025-05-24 08:12:59,815 - INFO - Typing prompt: Please       Check if the second paragraph of the ...
2025-05-24 08:13:35,504 - INFO - Pressing Enter to send prompt
2025-05-24 08:13:35,610 - INFO - Waiting 100 seconds for response...
2025-05-24 08:14:05,611 - INFO - Still waiting: 69 seconds remaining...
2025-05-24 08:14:35,612 - INFO - Still waiting: 39 seconds remaining...
2025-05-24 08:15:05,613 - INFO - Still waiting: 9 seconds remaining...
2025-05-24 08:15:35,614 - INFO - Completed prompt 4/7
2025-05-24 08:15:35,614 - INFO - Processing prompt 5/7
2025-05-24 08:15:36,853 - INFO - Typing prompt: Please       Assess the logical flow and readabili...
2025-05-24 08:16:06,458 - INFO - Pressing Enter to send prompt
2025-05-24 08:16:06,566 - INFO - Waiting 100 seconds for response...
2025-05-24 08:16:36,567 - INFO - Still waiting: 69 seconds remaining...
2025-05-24 08:17:06,568 - INFO - Still waiting: 39 seconds remaining...
2025-05-24 08:17:36,569 - INFO - Still waiting: 9 seconds remaining...
2025-05-24 08:18:06,570 - INFO - Completed prompt 5/7
2025-05-24 08:18:06,570 - INFO - Processing prompt 6/7
2025-05-24 08:18:07,794 - INFO - Typing prompt: Please       Evaluate if the second paragraph of t...
2025-05-24 08:18:43,826 - INFO - Pressing Enter to send prompt
2025-05-24 08:18:43,927 - INFO - Waiting 100 seconds for response...
2025-05-24 08:19:13,928 - INFO - Still waiting: 69 seconds remaining...
2025-05-24 08:19:43,928 - INFO - Still waiting: 39 seconds remaining...
2025-05-24 08:20:13,933 - INFO - Still waiting: 9 seconds remaining...
2025-05-24 08:20:43,934 - INFO - Completed prompt 6/7
2025-05-24 08:20:43,934 - INFO - Processing prompt 7/7
2025-05-24 08:20:45,150 - INFO - Typing prompt: Please       Using all of this information write a...
2025-05-24 08:20:58,688 - INFO - Pressing Enter to send prompt
2025-05-24 08:20:58,795 - INFO - Waiting 100 seconds for response...
2025-05-24 08:21:28,796 - INFO - Still waiting: 69 seconds remaining...
2025-05-24 08:21:58,797 - INFO - Still waiting: 39 seconds remaining...
2025-05-24 08:22:28,799 - INFO - Still waiting: 9 seconds remaining...
2025-05-24 08:22:58,804 - INFO - Completed prompt 7/7
2025-05-24 08:22:58,805 - INFO - All prompts processed.
2025-05-24 08:22:58,805 - INFO - Closing browser...
2025-05-24 08:23:00,953 - INFO - Browser closed.
2025-05-24 08:23:00,953 - INFO - === Session session6 FAILED ===
2025-05-24 08:23:00,953 - INFO - Waiting 10 seconds before next session...
2025-05-24 08:23:10,973 - INFO - === Starting session: session7 ===
2025-05-24 08:23:10,973 - INFO - Session name: Code Tasks
2025-05-24 08:23:10,988 - INFO - Number of prompts: 8
2025-05-24 08:23:10,988 - INFO - Launching Chrome: C:\Program Files\Google\Chrome\Application\chrome.exe
2025-05-24 08:23:10,988 - INFO - Using profile: C:\Temp\ClaudeProfile
2025-05-24 08:23:11,004 - INFO - Navigating to: https://claude.ai/project/0196f2ac-2f4b-7714-808e-f71ecaaca3f8
2025-05-24 08:23:11,020 - INFO - Waiting for browser to initialize (10 seconds)
2025-05-24 08:23:21,032 - INFO - Running session: session7
2025-05-24 08:23:21,032 - INFO - Waiting 15 seconds for page to load and for user to handle any login...
2025-05-24 08:23:36,042 - INFO - Processing prompt 1/8
2025-05-24 08:23:37,251 - INFO - Typing prompt: Please       Review the third paragraph of the cov...
2025-05-24 08:24:19,993 - INFO - Pressing Enter to send prompt
2025-05-24 08:24:20,098 - INFO - Waiting 100 seconds for response...
2025-05-24 08:24:50,099 - INFO - Still waiting: 69 seconds remaining...
2025-05-24 08:25:20,101 - INFO - Still waiting: 39 seconds remaining...
2025-05-24 08:25:50,103 - INFO - Still waiting: 9 seconds remaining...
2025-05-24 08:26:20,104 - INFO - Completed prompt 1/8
2025-05-24 08:26:20,104 - INFO - Processing prompt 2/8
2025-05-24 08:26:21,319 - INFO - Typing prompt: Please       Evaluate if the candidate’s motivat...
2025-05-24 08:26:58,811 - INFO - Pressing Enter to send prompt
2025-05-24 08:26:58,917 - INFO - Waiting 100 seconds for response...
2025-05-24 08:27:28,917 - INFO - Still waiting: 69 seconds remaining...
2025-05-24 08:27:58,923 - INFO - Still waiting: 39 seconds remaining...
2025-05-24 08:28:28,923 - INFO - Still waiting: 9 seconds remaining...
2025-05-24 08:28:58,925 - INFO - Completed prompt 2/8
2025-05-24 08:28:58,925 - INFO - Processing prompt 3/8
2025-05-24 08:29:00,141 - INFO - Typing prompt: Please       Analyze how clearly the third paragra...
2025-05-24 08:29:45,522 - INFO - Pressing Enter to send prompt
2025-05-24 08:29:45,631 - INFO - Waiting 100 seconds for response...
2025-05-24 08:30:15,632 - INFO - Still waiting: 69 seconds remaining...
2025-05-24 08:30:45,632 - INFO - Still waiting: 39 seconds remaining...
2025-05-24 08:31:15,633 - INFO - Still waiting: 9 seconds remaining...
2025-05-24 08:31:45,640 - INFO - Completed prompt 3/8
2025-05-24 08:31:45,641 - INFO - Processing prompt 4/8
2025-05-24 08:31:46,859 - INFO - Typing prompt: Please       Assess if the candidate effectively c...
2025-05-24 08:32:25,021 - INFO - Pressing Enter to send prompt
2025-05-24 08:32:25,122 - INFO - Waiting 100 seconds for response...
2025-05-24 08:32:55,124 - INFO - Still waiting: 69 seconds remaining...
2025-05-24 08:33:25,126 - INFO - Still waiting: 39 seconds remaining...
2025-05-24 08:33:55,127 - INFO - Still waiting: 9 seconds remaining...
2025-05-24 08:34:25,128 - INFO - Completed prompt 4/8
2025-05-24 08:34:25,129 - INFO - Processing prompt 5/8
2025-05-24 08:34:26,370 - INFO - Typing prompt: Please       Evaluate if my enthusiasm feels since...
2025-05-24 08:34:54,427 - INFO - Pressing Enter to send prompt
2025-05-24 08:34:54,529 - INFO - Waiting 100 seconds for response...
2025-05-24 08:35:24,530 - INFO - Still waiting: 69 seconds remaining...
2025-05-24 08:35:54,539 - INFO - Still waiting: 39 seconds remaining...
2025-05-24 08:36:24,541 - INFO - Still waiting: 9 seconds remaining...
2025-05-24 08:36:54,542 - INFO - Completed prompt 5/8
2025-05-24 08:36:54,542 - INFO - Processing prompt 6/8
2025-05-24 08:36:55,775 - INFO - Typing prompt: Please       Identify opportunities to briefly men...
2025-05-24 08:37:21,885 - INFO - Pressing Enter to send prompt
2025-05-24 08:37:21,998 - INFO - Waiting 100 seconds for response...
2025-05-24 08:37:51,999 - INFO - Still waiting: 69 seconds remaining...
2025-05-24 08:38:22,002 - INFO - Still waiting: 39 seconds remaining...
2025-05-24 08:38:52,003 - INFO - Still waiting: 9 seconds remaining...
2025-05-24 08:39:22,007 - INFO - Completed prompt 6/8
2025-05-24 08:39:22,008 - INFO - Processing prompt 7/8
2025-05-24 08:39:23,226 - INFO - Typing prompt: Please       Evaluate whether the tone of the para...
2025-05-24 08:39:58,361 - INFO - Pressing Enter to send prompt
2025-05-24 08:39:58,470 - INFO - Waiting 100 seconds for response...
2025-05-24 08:40:28,471 - INFO - Still waiting: 69 seconds remaining...
2025-05-24 08:40:58,473 - INFO - Still waiting: 39 seconds remaining...
2025-05-24 08:41:28,481 - INFO - Still waiting: 9 seconds remaining...
2025-05-24 08:41:58,483 - INFO - Completed prompt 7/8
2025-05-24 08:41:58,483 - INFO - Processing prompt 8/8
2025-05-24 08:41:59,705 - INFO - Typing prompt: Please       Using all of this information write a...
2025-05-24 08:42:14,095 - INFO - Pressing Enter to send prompt
2025-05-24 08:42:14,196 - INFO - Waiting 100 seconds for response...
2025-05-24 08:42:44,197 - INFO - Still waiting: 69 seconds remaining...
2025-05-24 08:43:14,198 - INFO - Still waiting: 39 seconds remaining...
2025-05-24 08:43:44,199 - INFO - Still waiting: 9 seconds remaining...
2025-05-24 08:44:14,200 - INFO - Completed prompt 8/8
2025-05-24 08:44:14,200 - INFO - All prompts processed.
2025-05-24 08:44:14,207 - INFO - Closing browser...
2025-05-24 08:44:16,373 - INFO - Browser closed.
2025-05-24 08:44:16,373 - INFO - === Session session7 FAILED ===
2025-05-24 08:44:16,373 - INFO - Waiting 10 seconds before next session...
2025-05-24 08:44:26,393 - INFO - === Starting session: session8 ===
2025-05-24 08:44:26,393 - INFO - Session name: Code Tasks
2025-05-24 08:44:26,393 - INFO - Number of prompts: 7
2025-05-24 08:44:26,408 - INFO - Launching Chrome: C:\Program Files\Google\Chrome\Application\chrome.exe
2025-05-24 08:44:26,408 - INFO - Using profile: C:\Temp\ClaudeProfile
2025-05-24 08:44:26,424 - INFO - Navigating to: https://claude.ai/project/0196f2ac-2f4b-7714-808e-f71ecaaca3f8
2025-05-24 08:44:26,439 - INFO - Waiting for browser to initialize (10 seconds)
2025-05-24 08:44:36,447 - INFO - Running session: session8
2025-05-24 08:44:36,448 - INFO - Waiting 15 seconds for page to load and for user to handle any login...
2025-05-24 08:44:51,461 - INFO - Processing prompt 1/7
2025-05-24 08:44:52,677 - INFO - Typing prompt: Please       Evaluate how effectively this paragra...
2025-05-24 08:45:24,956 - INFO - Pressing Enter to send prompt
2025-05-24 08:45:25,057 - INFO - Waiting 100 seconds for response...
2025-05-24 08:45:55,062 - INFO - Still waiting: 69 seconds remaining...
2025-05-24 08:46:25,068 - INFO - Still waiting: 39 seconds remaining...
2025-05-24 08:46:55,068 - INFO - Still waiting: 9 seconds remaining...
2025-05-24 08:47:25,069 - INFO - Completed prompt 1/7
2025-05-24 08:47:25,069 - INFO - Processing prompt 2/7
2025-05-24 08:47:26,284 - INFO - Typing prompt: Please       Assess if the closing statement inclu...
2025-05-24 08:47:58,544 - INFO - Pressing Enter to send prompt
2025-05-24 08:47:58,650 - INFO - Waiting 100 seconds for response...
2025-05-24 08:48:28,697 - INFO - Still waiting: 69 seconds remaining...
2025-05-24 08:48:58,697 - INFO - Still waiting: 39 seconds remaining...
2025-05-24 08:49:28,698 - INFO - Still waiting: 9 seconds remaining...
2025-05-24 08:49:58,699 - INFO - Completed prompt 2/7
2025-05-24 08:49:58,699 - INFO - Processing prompt 3/7
2025-05-24 08:49:59,922 - INFO - Typing prompt: Please       Evaluate if the closing maintains a p...
2025-05-24 08:50:27,991 - INFO - Pressing Enter to send prompt
2025-05-24 08:50:28,097 - INFO - Waiting 100 seconds for response...
2025-05-24 08:50:58,099 - INFO - Still waiting: 69 seconds remaining...
2025-05-24 08:51:28,101 - INFO - Still waiting: 39 seconds remaining...
2025-05-24 08:51:58,102 - INFO - Still waiting: 9 seconds remaining...
2025-05-24 08:52:28,103 - INFO - Completed prompt 3/7
2025-05-24 08:52:28,103 - INFO - Processing prompt 4/7
2025-05-24 08:52:29,326 - INFO - Typing prompt: Please      Identify extraneous information or wea...
2025-05-24 08:52:56,431 - INFO - Pressing Enter to send prompt
2025-05-24 08:52:56,539 - INFO - Waiting 100 seconds for response...
2025-05-24 08:53:26,540 - INFO - Still waiting: 69 seconds remaining...
2025-05-24 08:53:56,541 - INFO - Still waiting: 39 seconds remaining...
2025-05-24 08:54:26,541 - INFO - Still waiting: 9 seconds remaining...
2025-05-24 08:54:56,547 - INFO - Completed prompt 4/7
2025-05-24 08:54:56,548 - INFO - Processing prompt 5/7
2025-05-24 08:54:57,756 - INFO - Typing prompt: Please       Analyze whether the closing paragraph...
2025-05-24 08:55:33,867 - INFO - Pressing Enter to send prompt
2025-05-24 08:55:33,977 - INFO - Waiting 100 seconds for response...
2025-05-24 08:56:03,978 - INFO - Still waiting: 69 seconds remaining...
2025-05-24 08:56:33,980 - INFO - Still waiting: 39 seconds remaining...
2025-05-24 08:57:03,981 - INFO - Still waiting: 9 seconds remaining...
2025-05-24 08:57:33,982 - INFO - Completed prompt 5/7
2025-05-24 08:57:33,982 - INFO - Processing prompt 6/7
2025-05-24 08:57:35,205 - INFO - Typing prompt: Please       Review the closing paragraph of the c...
2025-05-24 08:58:15,900 - INFO - Pressing Enter to send prompt
2025-05-24 08:58:16,002 - INFO - Waiting 100 seconds for response...
2025-05-24 08:58:46,003 - INFO - Still waiting: 69 seconds remaining...
2025-05-24 08:59:16,004 - INFO - Still waiting: 39 seconds remaining...
2025-05-24 08:59:46,006 - INFO - Still waiting: 9 seconds remaining...
2025-05-24 09:00:16,008 - INFO - Completed prompt 6/7
2025-05-24 09:00:16,009 - INFO - Processing prompt 7/7
2025-05-24 09:00:17,227 - INFO - Typing prompt: Please       Using all of this information write a...
2025-05-24 09:00:30,771 - INFO - Pressing Enter to send prompt
2025-05-24 09:00:30,873 - INFO - Waiting 100 seconds for response...
2025-05-24 09:01:00,873 - INFO - Still waiting: 69 seconds remaining...
2025-05-24 09:01:30,874 - INFO - Still waiting: 39 seconds remaining...
2025-05-24 09:02:00,876 - INFO - Still waiting: 9 seconds remaining...
2025-05-24 09:02:30,877 - INFO - Completed prompt 7/7
2025-05-24 09:02:30,877 - INFO - All prompts processed.
2025-05-24 09:02:30,890 - INFO - Closing browser...
2025-05-24 09:02:33,072 - INFO - Browser closed.
2025-05-24 09:02:33,072 - INFO - === Session session8 FAILED ===
2025-05-24 09:02:33,072 - INFO - === SESSION RESULTS SUMMARY ===
2025-05-24 09:02:33,088 - INFO - Total sessions: 4
2025-05-24 09:02:33,104 - INFO - Successful: 0
2025-05-24 09:02:33,104 - INFO - Failed: 4
2025-05-24 09:02:33,104 - INFO - Session 'session5': FAILED
2025-05-24 09:02:33,104 - INFO - Session 'session6': FAILED
2025-05-24 09:02:33,104 - INFO - Session 'session7': FAILED
2025-05-24 09:02:33,104 - INFO - Session 'session8': FAILED
2025-05-24 09:02:33,104 - INFO - === CLAUDE SIMPLE SENDER COMPLETED ===
